product_id,product_name,description,price,discount_percentage,category,brand,stock_quantity,color,size,weight,dimensions,release_date,rating,reviews_count,seller_name,seller_rating,seller_reviews_count,shipping_method,shipping_cost
506,lobortis ligula sit amet eleifend pede libero quis orci nullam molestie nibh,"Cras non velit nec nisi vulputate nonummy. Maecenas tincidunt lacus at velit. Vivamus vel nulla eget eros elementum pellentesque. Quisque porta volutpat erat. Quisque erat eros, viverra eget, congue eget, semper rutrum, nulla.",165.97,46.73,toys,libero nam dui proin leo odio porttitor id consequat in consequat ut nulla sed accumsan felis ut at dolor,892,Aquamarine,medium,5.9,lorem integer tincidunt ante vel ipsum praesent blandit lacinia erat vestibulum sed magna at nunc commodo placerat praesent,2010-04-14,4.5,299,in purus eu magna vulputate luctus cum sociis natoque penatibus et magnis dis parturient montes,3.0,865,free,35.14
507,vel augue vestibulum rutrum rutrum neque aenean auctor gravida sem praesent id massa id nisl,"Vestibulum ante ipsum primis in faucibus orci luctus et ultrices posuere cubilia Curae; Donec pharetra, magna vestibulum aliquet ultrices, erat tortor sollicitudin mi, sit amet lobortis sapien sapien non mi. Integer ac neque. Duis bibendum. Morbi non quam nec dui luctus rutrum. Nulla tellus. In sagittis dui vel nisl. Duis ac nibh. Fusce lacus purus, aliquet at, feugiat non, pretium quis, lectus. Suspendisse potenti. In eleifend quam a odio.",758.95,31.01,electronics,augue quam sollicitudin vitae consectetuer eget rutrum at lorem integer tincidunt ante vel ipsum praesent blandit lacinia erat vestibulum sed,383,Teal,small,3.6,at nunc commodo placerat praesent blandit nam nulla integer pede,2016-11-07,3.9,934,hac habitasse platea dictumst maecenas ut massa quis augue luctus,1.1,450,free,11.67
508,mi integer ac neque duis bibendum morbi non quam nec dui luctus rutrum nulla tellus in sagittis dui vel nisl,"Cum sociis natoque penatibus et magnis dis parturient montes, nascetur ridiculus mus. Etiam vel augue. Vestibulum rutrum rutrum neque. Aenean auctor gravida sem. Praesent id massa id nisl venenatis lacinia. Aenean sit amet justo.",697.26,38.8,electronics,duis faucibus accumsan odio curabitur convallis duis consequat dui nec nisi volutpat eleifend donec,860,Crimson,extra large,3.3,nulla mollis molestie lorem quisque ut erat curabitur gravida nisi at nibh in hac habitasse,2013-08-16,4.9,973,habitasse platea dictumst morbi vestibulum velit id pretium iaculis diam erat fermentum justo,2.1,122,free,28.8
509,porttitor lorem id ligula suspendisse ornare consequat lectus in est risus auctor sed tristique,Proin eu mi.,832.87,14.8,beauty,consectetuer adipiscing elit proin interdum mauris non ligula pellentesque ultrices phasellus id,165,Turquoise,small,5.8,nulla pede ullamcorper augue a suscipit nulla elit ac nulla sed vel enim sit amet nunc viverra,2020-04-30,2.6,652,aenean auctor gravida sem praesent id massa id nisl venenatis lacinia,4.5,533,standard,16.96
510,cubilia curae duis faucibus accumsan odio curabitur convallis duis consequat dui nec,Duis at velit eu est congue elementum.,855.92,22.61,beauty,ultrices mattis odio donec vitae nisi nam ultrices libero non mattis pulvinar nulla pede ullamcorper augue a suscipit nulla,360,Purple,medium,4.3,rutrum nulla tellus in sagittis dui vel nisl duis ac nibh fusce lacus purus aliquet at feugiat non pretium quis,2011-09-18,2.7,312,pede justo lacinia eget tincidunt eget tempus vel pede morbi porttitor lorem,2.8,648,express,6.9
511,cras non velit nec nisi vulputate nonummy maecenas tincidunt lacus at velit vivamus vel,Etiam pretium iaculis justo. In hac habitasse platea dictumst. Etiam faucibus cursus urna. Ut tellus. Nulla ut erat id mauris vulputate elementum. Nullam varius. Nulla facilisi. Cras non velit nec nisi vulputate nonummy.,54.66,36.7,home decor,in imperdiet et commodo vulputate justo in blandit ultrices enim lorem ipsum,267,Orange,medium,8.2,ultrices enim lorem ipsum dolor sit amet consectetuer adipiscing elit proin interdum mauris non ligula pellentesque ultrices phasellus id sapien,2021-11-29,4.5,356,justo maecenas rhoncus aliquam lacus morbi quis tortor id nulla ultrices aliquet maecenas leo odio condimentum id luctus nec,2.6,365,standard,11.04
512,volutpat in congue etiam justo etiam pretium iaculis justo in hac,Maecenas pulvinar lobortis est. Phasellus sit amet erat. Nulla tempus. Vivamus in felis eu sapien cursus vestibulum. Proin eu mi. Nulla ac enim.,441.34,45.89,toys,sagittis dui vel nisl duis ac nibh fusce lacus purus aliquet at feugiat non pretium quis lectus suspendisse potenti,682,Indigo,extra large,2.1,sit amet cursus id turpis integer aliquet massa id lobortis convallis,2021-05-19,3.5,918,id mauris vulputate elementum nullam varius nulla facilisi cras non velit nec,1.6,756,standard,13.62
513,etiam faucibus cursus urna ut tellus nulla ut erat id mauris vulputate elementum,"Fusce lacus purus, aliquet at, feugiat non, pretium quis, lectus. Suspendisse potenti. In eleifend quam a odio. In hac habitasse platea dictumst. Maecenas ut massa quis augue luctus tincidunt. Nulla mollis molestie lorem. Quisque ut erat. Curabitur gravida nisi at nibh. In hac habitasse platea dictumst. Aliquam augue quam, sollicitudin vitae, consectetuer eget, rutrum at, lorem.",527.48,45.42,beauty,lorem ipsum dolor sit amet consectetuer adipiscing elit proin interdum mauris non ligula pellentesque ultrices phasellus id sapien in,817,Pink,medium,3.8,sem fusce consequat nulla nisl nunc nisl duis bibendum felis sed interdum venenatis,2021-03-25,1.5,147,tempus sit amet sem fusce consequat nulla nisl nunc nisl duis bibendum felis sed,1.8,38,standard,43.76
514,auctor gravida sem praesent id massa id nisl venenatis lacinia aenean sit amet justo morbi ut,"Phasellus id sapien in sapien iaculis congue. Vivamus metus arcu, adipiscing molestie, hendrerit at, vulputate vitae, nisl. Aenean lectus. Pellentesque eget nunc. Donec quis orci eget orci vehicula condimentum. Curabitur in libero ut massa volutpat convallis.",326.9,1.25,electronics,interdum mauris ullamcorper purus sit amet nulla quisque arcu libero rutrum ac lobortis,951,Mauv,large,4.3,elementum pellentesque quisque porta volutpat erat quisque erat eros viverra eget congue eget semper rutrum nulla nunc purus phasellus in,2014-11-30,4.7,708,morbi vel lectus in quam fringilla rhoncus mauris enim leo rhoncus sed vestibulum sit amet cursus id turpis,2.1,620,express,25.69
515,orci eget orci vehicula condimentum curabitur in libero ut massa,"Aliquam augue quam, sollicitudin vitae, consectetuer eget, rutrum at, lorem. Integer tincidunt ante vel ipsum.",316.06,22.37,beauty,justo maecenas rhoncus aliquam lacus morbi quis tortor id nulla ultrices aliquet,291,Violet,large,5.3,luctus tincidunt nulla mollis molestie lorem quisque ut erat curabitur gravida nisi at nibh in hac habitasse platea dictumst,2013-01-28,1.4,491,nisi venenatis tristique fusce congue diam id ornare imperdiet sapien urna pretium nisl ut,4.4,482,free,49.52
516,vitae mattis nibh ligula nec sem duis aliquam convallis nunc proin at turpis a pede posuere nonummy integer,Vestibulum ante ipsum primis in faucibus orci luctus et ultrices posuere cubilia Curae; Duis faucibus accumsan odio. Curabitur convallis. Duis consequat dui nec nisi volutpat eleifend.,269.76,5.17,clothing,congue diam id ornare imperdiet sapien urna pretium nisl ut volutpat,516,Puce,extra large,7.1,quis orci nullam molestie nibh in lectus pellentesque at nulla suspendisse potenti cras in purus,2010-06-02,4.5,513,proin eu mi nulla ac enim in tempor turpis nec euismod scelerisque quam turpis adipiscing lorem,2.4,292,standard,14.15
517,velit nec nisi vulputate nonummy maecenas tincidunt lacus at velit vivamus vel nulla,In hac habitasse platea dictumst. Etiam faucibus cursus urna. Ut tellus. Nulla ut erat id mauris vulputate elementum. Nullam varius. Nulla facilisi. Cras non velit nec nisi vulputate nonummy. Maecenas tincidunt lacus at velit. Vivamus vel nulla eget eros elementum pellentesque. Quisque porta volutpat erat.,46.25,2.58,toys,elementum ligula vehicula consequat morbi a ipsum integer a nibh in quis justo maecenas rhoncus aliquam lacus morbi,416,Orange,extra large,9.3,tristique fusce congue diam id ornare imperdiet sapien urna pretium nisl ut volutpat sapien arcu sed augue,2013-08-14,1.3,984,libero nullam sit amet turpis elementum ligula vehicula consequat morbi,3.1,981,express,31.32
518,urna ut tellus nulla ut erat id mauris vulputate elementum nullam varius nulla facilisi cras non velit nec,"Nullam varius. Nulla facilisi. Cras non velit nec nisi vulputate nonummy. Maecenas tincidunt lacus at velit. Vivamus vel nulla eget eros elementum pellentesque. Quisque porta volutpat erat. Quisque erat eros, viverra eget, congue eget, semper rutrum, nulla. Nunc purus.",490.25,14.6,beauty,accumsan tortor quis turpis sed ante vivamus tortor duis mattis egestas metus aenean fermentum donec ut mauris,197,Maroon,extra large,7.9,duis at velit eu est congue elementum in hac habitasse platea dictumst morbi vestibulum,2022-09-25,2.5,995,vivamus tortor duis mattis egestas metus aenean fermentum donec ut mauris eget massa tempor convallis nulla neque libero convallis eget,3.3,683,free,37.26
519,integer tincidunt ante vel ipsum praesent blandit lacinia erat vestibulum,"Pellentesque ultrices mattis odio. Donec vitae nisi. Nam ultrices, libero non mattis pulvinar, nulla pede ullamcorper augue, a suscipit nulla elit ac nulla. Sed vel enim sit amet nunc viverra dapibus. Nulla suscipit ligula in lacus. Curabitur at ipsum ac tellus semper interdum. Mauris ullamcorper purus sit amet nulla. Quisque arcu libero, rutrum ac, lobortis vel, dapibus at, diam. Nam tristique tortor eu pede.",923.82,22.68,electronics,nec condimentum neque sapien placerat ante nulla justo aliquam quis turpis eget elit sodales scelerisque mauris sit amet eros,905,Puce,small,3.0,at vulputate vitae nisl aenean lectus pellentesque eget nunc donec quis orci eget orci vehicula condimentum,2013-09-07,1.1,767,vitae ipsum aliquam non mauris morbi non lectus aliquam sit,1.9,552,express,12.36
520,donec posuere metus vitae ipsum aliquam non mauris morbi non lectus aliquam sit amet diam in magna bibendum,"Integer a nibh. In quis justo. Maecenas rhoncus aliquam lacus. Morbi quis tortor id nulla ultrices aliquet. Maecenas leo odio, condimentum id, luctus nec, molestie sed, justo. Pellentesque viverra pede ac diam. Cras pellentesque volutpat dui.",165.28,37.76,electronics,vel est donec odio justo sollicitudin ut suscipit a feugiat et eros vestibulum ac est lacinia,153,Red,large,0.8,posuere metus vitae ipsum aliquam non mauris morbi non lectus aliquam sit amet diam,2020-10-23,3.0,451,proin at turpis a pede posuere nonummy integer non velit donec,1.9,268,free,35.41
521,ante vel ipsum praesent blandit lacinia erat vestibulum sed magna at nunc commodo placerat praesent blandit nam nulla integer,In hac habitasse platea dictumst. Etiam faucibus cursus urna. Ut tellus. Nulla ut erat id mauris vulputate elementum. Nullam varius. Nulla facilisi.,927.51,28.45,toys,interdum eu tincidunt in leo maecenas pulvinar lobortis est phasellus sit amet erat nulla tempus vivamus in felis,338,Aquamarine,small,1.3,vestibulum ante ipsum primis in faucibus orci luctus et ultrices posuere cubilia curae nulla dapibus dolor,2011-04-01,4.3,943,id nulla ultrices aliquet maecenas leo odio condimentum id luctus nec molestie sed justo pellentesque viverra pede ac diam,4.3,998,express,19.22
522,nibh in lectus pellentesque at nulla suspendisse potenti cras in purus eu magna vulputate luctus cum sociis natoque,"Pellentesque eget nunc. Donec quis orci eget orci vehicula condimentum. Curabitur in libero ut massa volutpat convallis. Morbi odio odio, elementum eu, interdum eu, tincidunt in, leo. Maecenas pulvinar lobortis est.",671.09,17.6,beauty,libero ut massa volutpat convallis morbi odio odio elementum eu interdum eu tincidunt in leo maecenas pulvinar lobortis est,902,Maroon,large,5.9,eros viverra eget congue eget semper rutrum nulla nunc purus phasellus in felis,2016-02-01,4.3,954,venenatis tristique fusce congue diam id ornare imperdiet sapien urna pretium nisl ut volutpat sapien arcu sed augue aliquam erat,2.4,79,free,13.89
523,amet sapien dignissim vestibulum vestibulum ante ipsum primis in faucibus orci luctus et ultrices,"Lorem ipsum dolor sit amet, consectetuer adipiscing elit. Proin interdum mauris non ligula pellentesque ultrices. Phasellus id sapien in sapien iaculis congue. Vivamus metus arcu, adipiscing molestie, hendrerit at, vulputate vitae, nisl. Aenean lectus. Pellentesque eget nunc. Donec quis orci eget orci vehicula condimentum. Curabitur in libero ut massa volutpat convallis. Morbi odio odio, elementum eu, interdum eu, tincidunt in, leo. Maecenas pulvinar lobortis est.",193.64,16.95,clothing,pulvinar sed nisl nunc rhoncus dui vel sem sed sagittis,221,Orange,medium,9.0,facilisi cras non velit nec nisi vulputate nonummy maecenas tincidunt lacus at,2017-09-19,4.2,902,nulla elit ac nulla sed vel enim sit amet nunc viverra dapibus nulla suscipit,4.8,221,free,3.09
524,aliquet massa id lobortis convallis tortor risus dapibus augue vel accumsan tellus nisi,Nulla tempus. Vivamus in felis eu sapien cursus vestibulum. Proin eu mi.,308.11,15.23,clothing,montes nascetur ridiculus mus etiam vel augue vestibulum rutrum rutrum neque,247,Purple,extra large,4.5,mi in porttitor pede justo eu massa donec dapibus duis at velit eu est congue elementum in hac,2017-10-04,3.2,146,tellus nisi eu orci mauris lacinia sapien quis libero nullam sit amet turpis elementum ligula vehicula,3.0,254,express,45.66
525,duis ac nibh fusce lacus purus aliquet at feugiat non pretium quis lectus suspendisse potenti in eleifend quam a,Praesent blandit lacinia erat. Vestibulum sed magna at nunc commodo placerat. Praesent blandit.,739.3,30.04,home decor,dui maecenas tristique est et tempus semper est quam pharetra magna ac consequat metus sapien,163,Indigo,large,3.9,nunc viverra dapibus nulla suscipit ligula in lacus curabitur at ipsum ac tellus semper interdum mauris ullamcorper purus,2021-04-02,4.9,95,duis at velit eu est congue elementum in hac habitasse,1.6,357,free,0.85
526,luctus tincidunt nulla mollis molestie lorem quisque ut erat curabitur gravida nisi at nibh in hac habitasse platea dictumst aliquam,"In tempor, turpis nec euismod scelerisque, quam turpis adipiscing lorem, vitae mattis nibh ligula nec sem. Duis aliquam convallis nunc. Proin at turpis a pede posuere nonummy. Integer non velit. Donec diam neque, vestibulum eget, vulputate ut, ultrices vel, augue. Vestibulum ante ipsum primis in faucibus orci luctus et ultrices posuere cubilia Curae; Donec pharetra, magna vestibulum aliquet ultrices, erat tortor sollicitudin mi, sit amet lobortis sapien sapien non mi. Integer ac neque. Duis bibendum. Morbi non quam nec dui luctus rutrum.",709.38,40.47,home decor,lectus aliquam sit amet diam in magna bibendum imperdiet nullam orci pede venenatis non sodales,9,Pink,large,7.0,ligula nec sem duis aliquam convallis nunc proin at turpis a pede posuere nonummy integer non velit donec diam,2017-09-23,1.5,381,cras pellentesque volutpat dui maecenas tristique est et tempus semper est,1.8,477,free,13.26
527,aenean lectus pellentesque eget nunc donec quis orci eget orci vehicula condimentum curabitur in libero ut massa,Nulla mollis molestie lorem.,670.14,25.2,toys,ac consequat metus sapien ut nunc vestibulum ante ipsum primis in faucibus orci,418,Turquoise,small,8.2,in eleifend quam a odio in hac habitasse platea dictumst maecenas ut massa quis,2015-03-09,3.2,131,turpis enim blandit mi in porttitor pede justo eu massa donec dapibus duis at,2.0,790,free,9.52
528,at lorem integer tincidunt ante vel ipsum praesent blandit lacinia erat vestibulum sed magna at nunc,Etiam vel augue. Vestibulum rutrum rutrum neque. Aenean auctor gravida sem.,892.52,21.74,clothing,lacus morbi quis tortor id nulla ultrices aliquet maecenas leo odio condimentum,310,Fuscia,large,1.5,quam sapien varius ut blandit non interdum in ante vestibulum ante ipsum primis in,2021-06-04,1.5,53,dolor quis odio consequat varius integer ac leo pellentesque ultrices mattis odio donec vitae nisi nam,4.2,744,standard,40.87
529,hac habitasse platea dictumst maecenas ut massa quis augue luctus tincidunt nulla,"Nullam varius. Nulla facilisi. Cras non velit nec nisi vulputate nonummy. Maecenas tincidunt lacus at velit. Vivamus vel nulla eget eros elementum pellentesque. Quisque porta volutpat erat. Quisque erat eros, viverra eget, congue eget, semper rutrum, nulla.",97.78,29.9,beauty,erat quisque erat eros viverra eget congue eget semper rutrum nulla nunc purus phasellus in felis,396,Violet,large,8.8,quis orci nullam molestie nibh in lectus pellentesque at nulla suspendisse,2017-01-04,3.7,336,posuere cubilia curae duis faucibus accumsan odio curabitur convallis duis consequat dui nec nisi volutpat eleifend donec,2.1,353,free,13.8
530,justo sit amet sapien dignissim vestibulum vestibulum ante ipsum primis in faucibus orci luctus et ultrices,Nulla facilisi. Cras non velit nec nisi vulputate nonummy. Maecenas tincidunt lacus at velit. Vivamus vel nulla eget eros elementum pellentesque. Quisque porta volutpat erat.,631.69,31.1,electronics,dui proin leo odio porttitor id consequat in consequat ut,439,Orange,large,2.7,phasellus in felis donec semper sapien a libero nam dui proin leo odio porttitor id consequat in consequat,2021-03-07,2.6,235,consequat dui nec nisi volutpat eleifend donec ut dolor morbi vel,4.4,981,free,13.13
531,potenti cras in purus eu magna vulputate luctus cum sociis natoque penatibus et magnis dis parturient montes,"Morbi non quam nec dui luctus rutrum. Nulla tellus. In sagittis dui vel nisl. Duis ac nibh. Fusce lacus purus, aliquet at, feugiat non, pretium quis, lectus. Suspendisse potenti. In eleifend quam a odio. In hac habitasse platea dictumst. Maecenas ut massa quis augue luctus tincidunt. Nulla mollis molestie lorem.",884.46,39.63,electronics,id nulla ultrices aliquet maecenas leo odio condimentum id luctus nec,622,Violet,extra large,0.4,mi sit amet lobortis sapien sapien non mi integer ac neque duis bibendum morbi,2019-01-23,1.9,904,viverra diam vitae quam suspendisse potenti nullam porttitor lacus at turpis donec posuere metus vitae ipsum aliquam non mauris morbi,4.7,67,express,14.93
532,lacus curabitur at ipsum ac tellus semper interdum mauris ullamcorper purus sit amet nulla quisque arcu,"Mauris sit amet eros. Suspendisse accumsan tortor quis turpis. Sed ante. Vivamus tortor. Duis mattis egestas metus. Aenean fermentum. Donec ut mauris eget massa tempor convallis. Nulla neque libero, convallis eget, eleifend luctus, ultricies eu, nibh. Quisque id justo sit amet sapien dignissim vestibulum. Vestibulum ante ipsum primis in faucibus orci luctus et ultrices posuere cubilia Curae; Nulla dapibus dolor vel est.",454.86,39.81,clothing,praesent lectus vestibulum quam sapien varius ut blandit non interdum,765,Fuscia,medium,8.7,quisque id justo sit amet sapien dignissim vestibulum vestibulum ante ipsum,2019-01-18,2.6,37,sagittis nam congue risus semper porta volutpat quam pede lobortis,4.1,355,standard,28.23
533,iaculis diam erat fermentum justo nec condimentum neque sapien placerat ante nulla justo aliquam quis turpis eget elit sodales,"Vestibulum ante ipsum primis in faucibus orci luctus et ultrices posuere cubilia Curae; Nulla dapibus dolor vel est. Donec odio justo, sollicitudin ut, suscipit a, feugiat et, eros. Vestibulum ac est lacinia nisi venenatis tristique. Fusce congue, diam id ornare imperdiet, sapien urna pretium nisl, ut volutpat sapien arcu sed augue. Aliquam erat volutpat. In congue. Etiam justo. Etiam pretium iaculis justo. In hac habitasse platea dictumst. Etiam faucibus cursus urna.",190.28,1.53,beauty,vulputate ut ultrices vel augue vestibulum ante ipsum primis in faucibus orci luctus et ultrices,331,Puce,extra large,2.9,sit amet consectetuer adipiscing elit proin risus praesent lectus vestibulum quam sapien varius ut,2018-09-12,3.1,321,nec sem duis aliquam convallis nunc proin at turpis a pede posuere nonummy integer,3.1,580,express,11.04
534,morbi porttitor lorem id ligula suspendisse ornare consequat lectus in est risus auctor sed tristique,"Suspendisse potenti. Cras in purus eu magna vulputate luctus. Cum sociis natoque penatibus et magnis dis parturient montes, nascetur ridiculus mus. Vivamus vestibulum sagittis sapien. Cum sociis natoque penatibus et magnis dis parturient montes, nascetur ridiculus mus. Etiam vel augue. Vestibulum rutrum rutrum neque. Aenean auctor gravida sem.",623.34,13.8,beauty,justo in hac habitasse platea dictumst etiam faucibus cursus urna ut tellus nulla ut,399,Orange,medium,4.8,nunc rhoncus dui vel sem sed sagittis nam congue risus semper porta volutpat,2016-03-16,1.2,297,habitasse platea dictumst etiam faucibus cursus urna ut tellus nulla ut,3.2,540,express,16.86
535,et eros vestibulum ac est lacinia nisi venenatis tristique fusce,"Vestibulum ante ipsum primis in faucibus orci luctus et ultrices posuere cubilia Curae; Nulla dapibus dolor vel est. Donec odio justo, sollicitudin ut, suscipit a, feugiat et, eros. Vestibulum ac est lacinia nisi venenatis tristique. Fusce congue, diam id ornare imperdiet, sapien urna pretium nisl, ut volutpat sapien arcu sed augue. Aliquam erat volutpat. In congue. Etiam justo. Etiam pretium iaculis justo. In hac habitasse platea dictumst. Etiam faucibus cursus urna.",250.44,12.64,beauty,pretium iaculis justo in hac habitasse platea dictumst etiam faucibus cursus urna,392,Yellow,medium,9.0,posuere cubilia curae mauris viverra diam vitae quam suspendisse potenti nullam porttitor lacus at turpis donec posuere,2015-10-02,3.4,838,nulla suspendisse potenti cras in purus eu magna vulputate luctus cum,2.3,202,express,5.71
536,sapien sapien non mi integer ac neque duis bibendum morbi non quam nec dui,Fusce consequat.,592.25,5.55,electronics,quam fringilla rhoncus mauris enim leo rhoncus sed vestibulum sit amet cursus id turpis integer aliquet massa id,995,Fuscia,extra large,5.1,quis augue luctus tincidunt nulla mollis molestie lorem quisque ut erat curabitur gravida nisi,2022-11-15,4.5,4,duis ac nibh fusce lacus purus aliquet at feugiat non pretium quis lectus suspendisse potenti in,4.4,207,free,30.8
537,sit amet eleifend pede libero quis orci nullam molestie nibh in lectus pellentesque at nulla suspendisse,"Suspendisse potenti. Cras in purus eu magna vulputate luctus. Cum sociis natoque penatibus et magnis dis parturient montes, nascetur ridiculus mus. Vivamus vestibulum sagittis sapien. Cum sociis natoque penatibus et magnis dis parturient montes, nascetur ridiculus mus. Etiam vel augue. Vestibulum rutrum rutrum neque.",419.4,29.88,electronics,blandit nam nulla integer pede justo lacinia eget tincidunt eget tempus vel pede morbi porttitor lorem id ligula,481,Khaki,small,2.9,libero rutrum ac lobortis vel dapibus at diam nam tristique tortor eu,2021-09-26,4.3,936,volutpat eleifend donec ut dolor morbi vel lectus in quam fringilla rhoncus mauris enim leo,4.4,539,standard,43.39
538,quis orci eget orci vehicula condimentum curabitur in libero ut massa,"Donec ut dolor. Morbi vel lectus in quam fringilla rhoncus. Mauris enim leo, rhoncus sed, vestibulum sit amet, cursus id, turpis.",305.13,16.91,beauty,diam erat fermentum justo nec condimentum neque sapien placerat ante,135,Turquoise,extra large,2.5,est lacinia nisi venenatis tristique fusce congue diam id ornare imperdiet sapien urna pretium nisl ut volutpat,2012-11-05,3.6,529,donec pharetra magna vestibulum aliquet ultrices erat tortor sollicitudin mi,2.1,861,express,44.52
539,eget eleifend luctus ultricies eu nibh quisque id justo sit amet sapien dignissim vestibulum vestibulum ante ipsum primis in faucibus,Integer a nibh. In quis justo. Maecenas rhoncus aliquam lacus.,276.2,47.74,clothing,eleifend quam a odio in hac habitasse platea dictumst maecenas ut massa quis augue luctus,969,Turquoise,extra large,1.0,phasellus in felis donec semper sapien a libero nam dui proin leo odio porttitor id consequat,2022-03-10,1.6,175,proin at turpis a pede posuere nonummy integer non velit donec,4.4,541,free,5.32
540,sit amet nulla quisque arcu libero rutrum ac lobortis vel dapibus at diam nam tristique tortor eu pede,"Nunc nisl. Duis bibendum, felis sed interdum venenatis, turpis enim blandit mi, in porttitor pede justo eu massa. Donec dapibus. Duis at velit eu est congue elementum. In hac habitasse platea dictumst. Morbi vestibulum, velit id pretium iaculis, diam erat fermentum justo, nec condimentum neque sapien placerat ante. Nulla justo. Aliquam quis turpis eget elit sodales scelerisque.",154.79,37.45,electronics,sit amet turpis elementum ligula vehicula consequat morbi a ipsum integer a nibh in quis justo,11,Yellow,large,1.0,venenatis turpis enim blandit mi in porttitor pede justo eu massa donec dapibus duis at velit eu est,2019-12-22,2.4,693,ullamcorper augue a suscipit nulla elit ac nulla sed vel enim sit amet nunc viverra dapibus nulla suscipit ligula in,1.8,536,free,13.2
