product_id,product_name,description,price,discount_percentage,category,brand,stock_quantity,color,size,weight,dimensions,release_date,rating,reviews_count,seller_name,seller_rating,seller_reviews_count,shipping_method,shipping_cost
724,gravida sem praesent id massa id nisl venenatis lacinia aenean sit amet justo morbi ut odio cras mi pede,In sagittis dui vel nisl. Duis ac nibh.,940.47,20.43,electronics,id ligula suspendisse ornare consequat lectus in est risus auctor sed,910,Goldenrod,medium,6.2,nec nisi volutpat eleifend donec ut dolor morbi vel lectus in quam fringilla rhoncus mauris enim leo rhoncus,2017-09-09,4.2,898,neque sapien placerat ante nulla justo aliquam quis turpis eget elit sodales scelerisque mauris sit amet,3.6,337,standard,35.5
725,curabitur gravida nisi at nibh in hac habitasse platea dictumst aliquam augue quam sollicitudin vitae,"Nulla neque libero, convallis eget, eleifend luctus, ultricies eu, nibh. Quisque id justo sit amet sapien dignissim vestibulum.",481.68,39.72,clothing,at turpis donec posuere metus vitae ipsum aliquam non mauris morbi non lectus,829,Aquamarine,extra large,6.1,at vulputate vitae nisl aenean lectus pellentesque eget nunc donec quis orci eget orci,2011-03-17,1.8,495,aliquam sit amet diam in magna bibendum imperdiet nullam orci pede venenatis non,3.3,13,free,40.42
726,augue luctus tincidunt nulla mollis molestie lorem quisque ut erat curabitur gravida nisi at nibh in hac habitasse,"Cum sociis natoque penatibus et magnis dis parturient montes, nascetur ridiculus mus. Vivamus vestibulum sagittis sapien. Cum sociis natoque penatibus et magnis dis parturient montes, nascetur ridiculus mus. Etiam vel augue. Vestibulum rutrum rutrum neque. Aenean auctor gravida sem. Praesent id massa id nisl venenatis lacinia. Aenean sit amet justo. Morbi ut odio.",123.35,43.3,home decor,mauris vulputate elementum nullam varius nulla facilisi cras non velit nec nisi vulputate,746,Teal,medium,0.9,ut mauris eget massa tempor convallis nulla neque libero convallis eget eleifend luctus ultricies eu nibh quisque id justo,2018-11-25,3.7,491,justo sit amet sapien dignissim vestibulum vestibulum ante ipsum primis in faucibus,1.0,578,free,7.75
727,nulla sed vel enim sit amet nunc viverra dapibus nulla suscipit ligula in lacus curabitur at ipsum,Proin risus. Praesent lectus.,430.6,31.38,beauty,nullam sit amet turpis elementum ligula vehicula consequat morbi a ipsum,43,Turquoise,medium,2.5,amet lobortis sapien sapien non mi integer ac neque duis bibendum morbi non quam nec dui luctus rutrum nulla tellus,2010-12-27,4.9,552,quis justo maecenas rhoncus aliquam lacus morbi quis tortor id nulla ultrices aliquet maecenas leo odio condimentum id,4.6,203,free,36.53
728,lacus morbi quis tortor id nulla ultrices aliquet maecenas leo odio,"Quisque porta volutpat erat. Quisque erat eros, viverra eget, congue eget, semper rutrum, nulla.",628.76,5.95,home decor,mi in porttitor pede justo eu massa donec dapibus duis at velit,31,Khaki,extra large,3.7,sem mauris laoreet ut rhoncus aliquet pulvinar sed nisl nunc rhoncus,2020-05-03,5.0,210,at nibh in hac habitasse platea dictumst aliquam augue quam sollicitudin vitae consectetuer eget rutrum at,3.5,804,express,40.73
729,vehicula condimentum curabitur in libero ut massa volutpat convallis morbi odio odio elementum eu interdum eu tincidunt,"Quisque id justo sit amet sapien dignissim vestibulum. Vestibulum ante ipsum primis in faucibus orci luctus et ultrices posuere cubilia Curae; Nulla dapibus dolor vel est. Donec odio justo, sollicitudin ut, suscipit a, feugiat et, eros. Vestibulum ac est lacinia nisi venenatis tristique. Fusce congue, diam id ornare imperdiet, sapien urna pretium nisl, ut volutpat sapien arcu sed augue. Aliquam erat volutpat. In congue. Etiam justo. Etiam pretium iaculis justo. In hac habitasse platea dictumst.",581.47,44.53,electronics,varius nulla facilisi cras non velit nec nisi vulputate nonummy maecenas tincidunt,499,Pink,large,6.4,proin eu mi nulla ac enim in tempor turpis nec euismod scelerisque quam turpis adipiscing lorem vitae mattis nibh,2022-09-02,1.8,267,libero convallis eget eleifend luctus ultricies eu nibh quisque id justo sit,1.3,867,express,46.69
730,luctus nec molestie sed justo pellentesque viverra pede ac diam cras pellentesque volutpat,"Phasellus id sapien in sapien iaculis congue. Vivamus metus arcu, adipiscing molestie, hendrerit at, vulputate vitae, nisl. Aenean lectus. Pellentesque eget nunc. Donec quis orci eget orci vehicula condimentum. Curabitur in libero ut massa volutpat convallis. Morbi odio odio, elementum eu, interdum eu, tincidunt in, leo. Maecenas pulvinar lobortis est. Phasellus sit amet erat. Nulla tempus.",602.26,30.52,clothing,semper est quam pharetra magna ac consequat metus sapien ut nunc vestibulum ante ipsum primis,808,Green,extra large,0.5,rhoncus aliquet pulvinar sed nisl nunc rhoncus dui vel sem sed sagittis nam congue risus semper porta,2010-08-12,3.1,389,augue quam sollicitudin vitae consectetuer eget rutrum at lorem integer tincidunt ante vel ipsum,1.9,909,free,36.26
731,ante ipsum primis in faucibus orci luctus et ultrices posuere cubilia curae nulla dapibus dolor,"Integer aliquet, massa id lobortis convallis, tortor risus dapibus augue, vel accumsan tellus nisi eu orci. Mauris lacinia sapien quis libero. Nullam sit amet turpis elementum ligula vehicula consequat. Morbi a ipsum. Integer a nibh. In quis justo. Maecenas rhoncus aliquam lacus. Morbi quis tortor id nulla ultrices aliquet.",437.89,11.52,beauty,scelerisque quam turpis adipiscing lorem vitae mattis nibh ligula nec sem duis aliquam convallis nunc proin,268,Maroon,medium,1.8,ullamcorper augue a suscipit nulla elit ac nulla sed vel,2011-06-07,3.2,893,curabitur in libero ut massa volutpat convallis morbi odio odio elementum eu interdum eu tincidunt in leo maecenas,4.7,855,free,49.73
732,turpis a pede posuere nonummy integer non velit donec diam neque vestibulum eget vulputate ut,"Fusce posuere felis sed lacus. Morbi sem mauris, laoreet ut, rhoncus aliquet, pulvinar sed, nisl. Nunc rhoncus dui vel sem. Sed sagittis. Nam congue, risus semper porta volutpat, quam pede lobortis ligula, sit amet eleifend pede libero quis orci. Nullam molestie nibh in lectus.",889.3,43.03,toys,nascetur ridiculus mus vivamus vestibulum sagittis sapien cum sociis natoque penatibus et magnis dis,885,Orange,small,1.3,ultrices erat tortor sollicitudin mi sit amet lobortis sapien sapien non mi integer ac neque duis bibendum,2022-10-08,4.4,907,massa tempor convallis nulla neque libero convallis eget eleifend luctus ultricies eu nibh quisque id justo sit amet sapien,3.0,999,express,1.05
733,odio cras mi pede malesuada in imperdiet et commodo vulputate justo in blandit ultrices enim,"Vestibulum ante ipsum primis in faucibus orci luctus et ultrices posuere cubilia Curae; Nulla dapibus dolor vel est. Donec odio justo, sollicitudin ut, suscipit a, feugiat et, eros. Vestibulum ac est lacinia nisi venenatis tristique. Fusce congue, diam id ornare imperdiet, sapien urna pretium nisl, ut volutpat sapien arcu sed augue. Aliquam erat volutpat. In congue.",330.32,29.91,toys,eu interdum eu tincidunt in leo maecenas pulvinar lobortis est phasellus sit amet erat nulla tempus vivamus,709,Goldenrod,small,9.0,vulputate luctus cum sociis natoque penatibus et magnis dis parturient montes,2018-05-22,1.6,455,in quam fringilla rhoncus mauris enim leo rhoncus sed vestibulum sit amet,1.4,471,standard,40.77
734,risus praesent lectus vestibulum quam sapien varius ut blandit non interdum in ante vestibulum ante ipsum primis in,"Nullam varius. Nulla facilisi. Cras non velit nec nisi vulputate nonummy. Maecenas tincidunt lacus at velit. Vivamus vel nulla eget eros elementum pellentesque. Quisque porta volutpat erat. Quisque erat eros, viverra eget, congue eget, semper rutrum, nulla. Nunc purus.",850.14,28.64,electronics,eget eleifend luctus ultricies eu nibh quisque id justo sit amet sapien dignissim vestibulum vestibulum ante ipsum primis,926,Red,large,3.5,orci vehicula condimentum curabitur in libero ut massa volutpat convallis morbi odio odio elementum eu interdum eu tincidunt,2018-02-06,3.7,822,metus aenean fermentum donec ut mauris eget massa tempor convallis,3.6,742,free,1.83
735,a nibh in quis justo maecenas rhoncus aliquam lacus morbi quis tortor id nulla,"Nulla mollis molestie lorem. Quisque ut erat. Curabitur gravida nisi at nibh. In hac habitasse platea dictumst. Aliquam augue quam, sollicitudin vitae, consectetuer eget, rutrum at, lorem. Integer tincidunt ante vel ipsum. Praesent blandit lacinia erat. Vestibulum sed magna at nunc commodo placerat. Praesent blandit.",30.1,9.6,clothing,eu orci mauris lacinia sapien quis libero nullam sit amet turpis elementum ligula vehicula consequat morbi a,978,Maroon,small,1.8,posuere felis sed lacus morbi sem mauris laoreet ut rhoncus aliquet pulvinar sed nisl nunc,2016-10-23,2.9,903,cras mi pede malesuada in imperdiet et commodo vulputate justo,1.5,770,express,24.35
736,et eros vestibulum ac est lacinia nisi venenatis tristique fusce congue diam id ornare imperdiet sapien urna,"Quisque ut erat. Curabitur gravida nisi at nibh. In hac habitasse platea dictumst. Aliquam augue quam, sollicitudin vitae, consectetuer eget, rutrum at, lorem. Integer tincidunt ante vel ipsum. Praesent blandit lacinia erat.",730.85,36.44,home decor,non interdum in ante vestibulum ante ipsum primis in faucibus orci,622,Aquamarine,medium,8.1,orci pede venenatis non sodales sed tincidunt eu felis fusce posuere felis sed lacus morbi sem mauris laoreet ut,2021-04-02,2.8,920,volutpat dui maecenas tristique est et tempus semper est quam pharetra magna ac consequat,3.3,474,standard,41.81
737,ut dolor morbi vel lectus in quam fringilla rhoncus mauris enim leo rhoncus sed vestibulum sit amet cursus id,"Integer a nibh. In quis justo. Maecenas rhoncus aliquam lacus. Morbi quis tortor id nulla ultrices aliquet. Maecenas leo odio, condimentum id, luctus nec, molestie sed, justo. Pellentesque viverra pede ac diam. Cras pellentesque volutpat dui. Maecenas tristique, est et tempus semper, est quam pharetra magna, ac consequat metus sapien ut nunc. Vestibulum ante ipsum primis in faucibus orci luctus et ultrices posuere cubilia Curae; Mauris viverra diam vitae quam. Suspendisse potenti.",332.53,42.72,clothing,eu est congue elementum in hac habitasse platea dictumst morbi vestibulum,550,Maroon,extra large,5.8,varius ut blandit non interdum in ante vestibulum ante ipsum primis in,2014-09-30,2.0,564,quisque erat eros viverra eget congue eget semper rutrum nulla nunc purus phasellus in felis,4.2,369,standard,22.88
738,vel lectus in quam fringilla rhoncus mauris enim leo rhoncus sed vestibulum sit amet cursus,"Nullam orci pede, venenatis non, sodales sed, tincidunt eu, felis. Fusce posuere felis sed lacus. Morbi sem mauris, laoreet ut, rhoncus aliquet, pulvinar sed, nisl. Nunc rhoncus dui vel sem. Sed sagittis. Nam congue, risus semper porta volutpat, quam pede lobortis ligula, sit amet eleifend pede libero quis orci. Nullam molestie nibh in lectus. Pellentesque at nulla.",661.22,20.9,clothing,et commodo vulputate justo in blandit ultrices enim lorem ipsum dolor sit amet consectetuer adipiscing,818,Aquamarine,small,7.5,sit amet eleifend pede libero quis orci nullam molestie nibh in,2010-07-02,2.9,466,imperdiet sapien urna pretium nisl ut volutpat sapien arcu sed augue aliquam erat volutpat,2.8,376,standard,12.94
739,in quam fringilla rhoncus mauris enim leo rhoncus sed vestibulum sit amet cursus id turpis integer aliquet massa id lobortis,"Aliquam non mauris. Morbi non lectus. Aliquam sit amet diam in magna bibendum imperdiet. Nullam orci pede, venenatis non, sodales sed, tincidunt eu, felis.",172.49,16.32,toys,vitae nisl aenean lectus pellentesque eget nunc donec quis orci eget orci vehicula condimentum curabitur in libero ut massa,327,Teal,large,1.3,eleifend donec ut dolor morbi vel lectus in quam fringilla rhoncus mauris enim leo rhoncus sed vestibulum sit,2022-06-28,2.2,546,aenean fermentum donec ut mauris eget massa tempor convallis nulla neque libero convallis eget eleifend,3.8,466,standard,37.67
740,integer ac neque duis bibendum morbi non quam nec dui luctus rutrum nulla tellus in sagittis dui vel nisl,Aliquam erat volutpat. In congue. Etiam justo.,426.18,3.56,beauty,vitae consectetuer eget rutrum at lorem integer tincidunt ante vel ipsum,588,Aquamarine,large,6.5,molestie lorem quisque ut erat curabitur gravida nisi at nibh in hac habitasse platea dictumst,2016-06-15,1.3,195,consectetuer eget rutrum at lorem integer tincidunt ante vel ipsum praesent blandit lacinia erat vestibulum sed magna at nunc commodo,4.1,292,standard,47.94
741,ac tellus semper interdum mauris ullamcorper purus sit amet nulla quisque arcu libero rutrum,In hac habitasse platea dictumst.,171.38,45.36,electronics,lacus at velit vivamus vel nulla eget eros elementum pellentesque quisque porta volutpat erat,904,Orange,extra large,8.3,pede malesuada in imperdiet et commodo vulputate justo in blandit ultrices enim lorem ipsum dolor sit,2013-12-25,1.6,306,dui nec nisi volutpat eleifend donec ut dolor morbi vel lectus in,2.0,89,express,45.35
742,elementum pellentesque quisque porta volutpat erat quisque erat eros viverra eget congue eget semper rutrum nulla nunc purus phasellus in,"Praesent blandit. Nam nulla. Integer pede justo, lacinia eget, tincidunt eget, tempus vel, pede. Morbi porttitor lorem id ligula. Suspendisse ornare consequat lectus. In est risus, auctor sed, tristique in, tempus sit amet, sem. Fusce consequat.",292.63,21.58,beauty,et magnis dis parturient montes nascetur ridiculus mus vivamus vestibulum sagittis sapien cum sociis natoque,909,Khaki,medium,0.9,felis eu sapien cursus vestibulum proin eu mi nulla ac enim in tempor turpis nec,2017-03-02,1.3,669,nulla justo aliquam quis turpis eget elit sodales scelerisque mauris sit amet eros suspendisse accumsan tortor,3.2,300,free,41.7
743,porttitor lacus at turpis donec posuere metus vitae ipsum aliquam non mauris morbi non lectus aliquam sit amet diam in,"Vestibulum quam sapien, varius ut, blandit non, interdum in, ante. Vestibulum ante ipsum primis in faucibus orci luctus et ultrices posuere cubilia Curae; Duis faucibus accumsan odio.",457.49,18.54,beauty,nulla suscipit ligula in lacus curabitur at ipsum ac tellus semper,524,Mauv,large,1.4,sem fusce consequat nulla nisl nunc nisl duis bibendum felis sed interdum venenatis turpis enim blandit,2014-02-28,1.7,811,morbi odio odio elementum eu interdum eu tincidunt in leo maecenas pulvinar lobortis est phasellus sit amet erat nulla tempus,2.0,115,express,37.85
744,nulla tempus vivamus in felis eu sapien cursus vestibulum proin,"Etiam faucibus cursus urna. Ut tellus. Nulla ut erat id mauris vulputate elementum. Nullam varius. Nulla facilisi. Cras non velit nec nisi vulputate nonummy. Maecenas tincidunt lacus at velit. Vivamus vel nulla eget eros elementum pellentesque. Quisque porta volutpat erat. Quisque erat eros, viverra eget, congue eget, semper rutrum, nulla.",959.86,36.61,clothing,natoque penatibus et magnis dis parturient montes nascetur ridiculus mus etiam vel augue vestibulum rutrum rutrum neque,244,Khaki,extra large,2.1,turpis elementum ligula vehicula consequat morbi a ipsum integer a nibh in quis justo maecenas,2018-07-18,3.4,470,eu interdum eu tincidunt in leo maecenas pulvinar lobortis est phasellus sit amet erat nulla tempus vivamus,1.8,632,standard,13.66
745,phasellus id sapien in sapien iaculis congue vivamus metus arcu adipiscing molestie hendrerit at vulputate vitae nisl aenean lectus,Proin interdum mauris non ligula pellentesque ultrices.,19.56,30.64,toys,morbi ut odio cras mi pede malesuada in imperdiet et commodo vulputate justo in blandit ultrices enim lorem ipsum dolor,134,Crimson,small,6.2,id pretium iaculis diam erat fermentum justo nec condimentum neque sapien placerat ante nulla justo,2020-02-17,2.5,249,orci vehicula condimentum curabitur in libero ut massa volutpat convallis morbi odio odio,2.2,551,express,21.51
746,id ligula suspendisse ornare consequat lectus in est risus auctor,"Fusce posuere felis sed lacus. Morbi sem mauris, laoreet ut, rhoncus aliquet, pulvinar sed, nisl. Nunc rhoncus dui vel sem. Sed sagittis. Nam congue, risus semper porta volutpat, quam pede lobortis ligula, sit amet eleifend pede libero quis orci. Nullam molestie nibh in lectus. Pellentesque at nulla. Suspendisse potenti. Cras in purus eu magna vulputate luctus. Cum sociis natoque penatibus et magnis dis parturient montes, nascetur ridiculus mus.",840.48,40.65,clothing,dolor morbi vel lectus in quam fringilla rhoncus mauris enim leo rhoncus sed vestibulum sit amet cursus,274,Puce,medium,0.8,ullamcorper purus sit amet nulla quisque arcu libero rutrum ac lobortis vel dapibus at diam nam,2010-06-26,1.8,334,eu magna vulputate luctus cum sociis natoque penatibus et magnis dis parturient montes nascetur ridiculus,1.2,342,standard,42.64
747,sodales sed tincidunt eu felis fusce posuere felis sed lacus morbi sem mauris laoreet ut rhoncus aliquet,"Vestibulum sed magna at nunc commodo placerat. Praesent blandit. Nam nulla. Integer pede justo, lacinia eget, tincidunt eget, tempus vel, pede. Morbi porttitor lorem id ligula. Suspendisse ornare consequat lectus. In est risus, auctor sed, tristique in, tempus sit amet, sem. Fusce consequat. Nulla nisl.",319.39,27.6,toys,eu nibh quisque id justo sit amet sapien dignissim vestibulum vestibulum ante ipsum,103,Yellow,extra large,1.2,venenatis non sodales sed tincidunt eu felis fusce posuere felis sed lacus,2015-05-25,4.7,153,elementum ligula vehicula consequat morbi a ipsum integer a nibh,5.0,496,free,30.66
748,ante vel ipsum praesent blandit lacinia erat vestibulum sed magna at nunc commodo,Nulla ut erat id mauris vulputate elementum. Nullam varius. Nulla facilisi. Cras non velit nec nisi vulputate nonummy.,196.94,46.78,toys,ut dolor morbi vel lectus in quam fringilla rhoncus mauris enim leo rhoncus,806,Orange,small,2.4,sed vel enim sit amet nunc viverra dapibus nulla suscipit ligula in lacus,2017-12-18,4.5,629,tincidunt lacus at velit vivamus vel nulla eget eros elementum pellentesque quisque porta volutpat erat quisque erat,3.6,983,express,20.95
749,at dolor quis odio consequat varius integer ac leo pellentesque ultrices mattis,Etiam faucibus cursus urna. Ut tellus. Nulla ut erat id mauris vulputate elementum. Nullam varius. Nulla facilisi. Cras non velit nec nisi vulputate nonummy. Maecenas tincidunt lacus at velit. Vivamus vel nulla eget eros elementum pellentesque.,500.35,44.32,clothing,morbi odio odio elementum eu interdum eu tincidunt in leo maecenas pulvinar lobortis est phasellus sit amet erat nulla,810,Orange,large,8.4,orci luctus et ultrices posuere cubilia curae mauris viverra diam vitae quam suspendisse potenti nullam,2012-11-13,2.4,960,maecenas pulvinar lobortis est phasellus sit amet erat nulla tempus vivamus in felis eu sapien,3.0,800,express,26.78
750,venenatis turpis enim blandit mi in porttitor pede justo eu,"Duis mattis egestas metus. Aenean fermentum. Donec ut mauris eget massa tempor convallis. Nulla neque libero, convallis eget, eleifend luctus, ultricies eu, nibh. Quisque id justo sit amet sapien dignissim vestibulum. Vestibulum ante ipsum primis in faucibus orci luctus et ultrices posuere cubilia Curae; Nulla dapibus dolor vel est. Donec odio justo, sollicitudin ut, suscipit a, feugiat et, eros. Vestibulum ac est lacinia nisi venenatis tristique. Fusce congue, diam id ornare imperdiet, sapien urna pretium nisl, ut volutpat sapien arcu sed augue.",9.94,24.08,home decor,metus sapien ut nunc vestibulum ante ipsum primis in faucibus orci luctus et ultrices posuere cubilia curae mauris viverra,887,Green,large,5.9,metus sapien ut nunc vestibulum ante ipsum primis in faucibus orci,2016-05-14,1.7,716,congue risus semper porta volutpat quam pede lobortis ligula sit amet,3.9,345,standard,3.72
751,lacinia sapien quis libero nullam sit amet turpis elementum ligula vehicula consequat morbi a ipsum integer a,"In tempor, turpis nec euismod scelerisque, quam turpis adipiscing lorem, vitae mattis nibh ligula nec sem. Duis aliquam convallis nunc. Proin at turpis a pede posuere nonummy. Integer non velit.",730.77,23.39,beauty,aenean lectus pellentesque eget nunc donec quis orci eget orci vehicula condimentum curabitur in libero ut massa volutpat convallis morbi,24,Pink,small,6.1,mauris lacinia sapien quis libero nullam sit amet turpis elementum ligula vehicula consequat morbi a ipsum,2016-09-24,2.2,922,duis mattis egestas metus aenean fermentum donec ut mauris eget massa tempor convallis nulla,4.4,274,free,0.39
752,luctus ultricies eu nibh quisque id justo sit amet sapien dignissim vestibulum vestibulum,In congue. Etiam justo. Etiam pretium iaculis justo. In hac habitasse platea dictumst. Etiam faucibus cursus urna. Ut tellus. Nulla ut erat id mauris vulputate elementum.,2.33,0.53,home decor,in porttitor pede justo eu massa donec dapibus duis at velit eu est,316,Goldenrod,large,6.4,ipsum aliquam non mauris morbi non lectus aliquam sit amet diam in,2020-05-08,4.4,213,tortor id nulla ultrices aliquet maecenas leo odio condimentum id luctus nec molestie sed justo pellentesque viverra,4.8,172,express,3.44
753,cursus vestibulum proin eu mi nulla ac enim in tempor turpis nec euismod scelerisque quam turpis adipiscing,"Vestibulum ante ipsum primis in faucibus orci luctus et ultrices posuere cubilia Curae; Duis faucibus accumsan odio. Curabitur convallis. Duis consequat dui nec nisi volutpat eleifend. Donec ut dolor. Morbi vel lectus in quam fringilla rhoncus. Mauris enim leo, rhoncus sed, vestibulum sit amet, cursus id, turpis. Integer aliquet, massa id lobortis convallis, tortor risus dapibus augue, vel accumsan tellus nisi eu orci. Mauris lacinia sapien quis libero. Nullam sit amet turpis elementum ligula vehicula consequat. Morbi a ipsum.",10.59,15.59,toys,est phasellus sit amet erat nulla tempus vivamus in felis eu sapien cursus vestibulum proin eu mi,859,Pink,small,7.4,non mi integer ac neque duis bibendum morbi non quam,2010-11-13,2.5,14,risus auctor sed tristique in tempus sit amet sem fusce consequat,1.9,457,express,19.85
754,sit amet sapien dignissim vestibulum vestibulum ante ipsum primis in faucibus orci luctus et ultrices posuere cubilia,Donec dapibus. Duis at velit eu est congue elementum. In hac habitasse platea dictumst.,78.49,0.85,home decor,non sodales sed tincidunt eu felis fusce posuere felis sed lacus morbi sem mauris laoreet ut rhoncus aliquet pulvinar,41,Puce,extra large,6.4,vestibulum ante ipsum primis in faucibus orci luctus et ultrices posuere,2018-08-18,2.9,859,nulla sed accumsan felis ut at dolor quis odio consequat varius integer ac,4.3,876,standard,36.73
755,dapibus dolor vel est donec odio justo sollicitudin ut suscipit a feugiat et eros vestibulum,"Vestibulum ante ipsum primis in faucibus orci luctus et ultrices posuere cubilia Curae; Duis faucibus accumsan odio. Curabitur convallis. Duis consequat dui nec nisi volutpat eleifend. Donec ut dolor. Morbi vel lectus in quam fringilla rhoncus. Mauris enim leo, rhoncus sed, vestibulum sit amet, cursus id, turpis. Integer aliquet, massa id lobortis convallis, tortor risus dapibus augue, vel accumsan tellus nisi eu orci.",533.5,6.62,home decor,nisl aenean lectus pellentesque eget nunc donec quis orci eget orci vehicula,55,Turquoise,extra large,5.5,tincidunt eget tempus vel pede morbi porttitor lorem id ligula suspendisse ornare,2017-05-25,3.9,676,mattis pulvinar nulla pede ullamcorper augue a suscipit nulla elit,2.6,378,standard,21.93
756,ut nulla sed accumsan felis ut at dolor quis odio consequat varius integer ac,"Aenean sit amet justo. Morbi ut odio. Cras mi pede, malesuada in, imperdiet et, commodo vulputate, justo.",416.33,15.05,home decor,rhoncus sed vestibulum sit amet cursus id turpis integer aliquet,150,Goldenrod,extra large,5.1,nec dui luctus rutrum nulla tellus in sagittis dui vel nisl duis ac,2013-11-15,1.8,582,vulputate luctus cum sociis natoque penatibus et magnis dis parturient montes,3.8,769,free,10.11
757,eros viverra eget congue eget semper rutrum nulla nunc purus phasellus in felis donec semper sapien a,Donec ut mauris eget massa tempor convallis.,101.78,1.07,toys,platea dictumst maecenas ut massa quis augue luctus tincidunt nulla mollis molestie lorem quisque ut,842,Khaki,medium,2.7,ut tellus nulla ut erat id mauris vulputate elementum nullam varius nulla facilisi cras non velit nec nisi,2015-11-12,3.4,632,dolor vel est donec odio justo sollicitudin ut suscipit a feugiat et eros vestibulum ac est lacinia nisi venenatis,2.6,51,express,11.3
758,feugiat non pretium quis lectus suspendisse potenti in eleifend quam,"Lorem ipsum dolor sit amet, consectetuer adipiscing elit. Proin interdum mauris non ligula pellentesque ultrices.",787.97,17.94,electronics,vivamus metus arcu adipiscing molestie hendrerit at vulputate vitae nisl aenean lectus pellentesque eget nunc donec quis orci eget,702,Yellow,medium,5.1,est donec odio justo sollicitudin ut suscipit a feugiat et eros vestibulum ac est lacinia nisi venenatis tristique fusce congue,2017-06-27,4.0,280,lobortis vel dapibus at diam nam tristique tortor eu pede,3.1,556,express,40.26
759,at turpis donec posuere metus vitae ipsum aliquam non mauris morbi non lectus aliquam sit amet diam in,Aenean auctor gravida sem. Praesent id massa id nisl venenatis lacinia.,840.08,43.94,toys,nec dui luctus rutrum nulla tellus in sagittis dui vel nisl duis ac nibh,382,Goldenrod,medium,4.5,nullam sit amet turpis elementum ligula vehicula consequat morbi a ipsum integer a nibh in quis justo maecenas,2018-05-24,3.1,652,amet lobortis sapien sapien non mi integer ac neque duis bibendum morbi non quam nec,1.3,754,free,41.17
