product_id,product_name,description,price,discount_percentage,category,brand,stock_quantity,color,size,weight,dimensions,release_date,rating,reviews_count,seller_name,seller_rating,seller_reviews_count,shipping_method,shipping_cost
257,blandit ultrices enim lorem ipsum dolor sit amet consectetuer adipiscing,"Integer ac leo. Pellentesque ultrices mattis odio. Donec vitae nisi. Nam ultrices, libero non mattis pulvinar, nulla pede ullamcorper augue, a suscipit nulla elit ac nulla. Sed vel enim sit amet nunc viverra dapibus. Nulla suscipit ligula in lacus. Curabitur at ipsum ac tellus semper interdum. Mauris ullamcorper purus sit amet nulla. Quisque arcu libero, rutrum ac, lobortis vel, dapibus at, diam.",234.72,12.29,clothing,cras in purus eu magna vulputate luctus cum sociis natoque penatibus et,76,Yellow,small,4.1,a pede posuere nonummy integer non velit donec diam neque vestibulum eget,2012-02-12,1.7,935,orci luctus et ultrices posuere cubilia curae duis faucibus accumsan odio curabitur convallis duis consequat dui nec,4.5,872,free,18.83
258,platea dictumst aliquam augue quam sollicitudin vitae consectetuer eget rutrum,"Vivamus vel nulla eget eros elementum pellentesque. Quisque porta volutpat erat. Quisque erat eros, viverra eget, congue eget, semper rutrum, nulla. Nunc purus. Phasellus in felis. Donec semper sapien a libero. Nam dui.",517.37,5.84,toys,et eros vestibulum ac est lacinia nisi venenatis tristique fusce congue diam id ornare imperdiet sapien urna pretium nisl,116,Yellow,small,1.7,accumsan felis ut at dolor quis odio consequat varius integer ac leo,2020-04-25,3.7,648,molestie lorem quisque ut erat curabitur gravida nisi at nibh in hac habitasse platea dictumst aliquam,2.5,283,express,21.21
259,ultrices posuere cubilia curae donec pharetra magna vestibulum aliquet ultrices erat tortor sollicitudin mi sit amet,"Nulla tellus. In sagittis dui vel nisl. Duis ac nibh. Fusce lacus purus, aliquet at, feugiat non, pretium quis, lectus.",115.83,24.5,electronics,integer ac neque duis bibendum morbi non quam nec dui luctus rutrum nulla tellus in,233,Khaki,small,7.8,ligula vehicula consequat morbi a ipsum integer a nibh in quis justo maecenas,2019-09-11,3.3,116,erat nulla tempus vivamus in felis eu sapien cursus vestibulum proin eu mi nulla ac enim in tempor,1.6,598,express,0.22
260,vel lectus in quam fringilla rhoncus mauris enim leo rhoncus sed vestibulum sit amet cursus id turpis integer aliquet,"Nulla ac enim. In tempor, turpis nec euismod scelerisque, quam turpis adipiscing lorem, vitae mattis nibh ligula nec sem. Duis aliquam convallis nunc. Proin at turpis a pede posuere nonummy. Integer non velit.",881.33,24.24,beauty,ornare consequat lectus in est risus auctor sed tristique in tempus sit amet sem fusce consequat nulla nisl,741,Violet,large,6.1,vestibulum proin eu mi nulla ac enim in tempor turpis nec euismod,2019-04-08,2.9,679,nullam orci pede venenatis non sodales sed tincidunt eu felis fusce posuere felis sed lacus morbi sem mauris laoreet,2.9,978,standard,4.41
261,venenatis turpis enim blandit mi in porttitor pede justo eu massa donec dapibus duis at velit eu est congue elementum,"Fusce congue, diam id ornare imperdiet, sapien urna pretium nisl, ut volutpat sapien arcu sed augue. Aliquam erat volutpat.",92.04,14.29,beauty,dui maecenas tristique est et tempus semper est quam pharetra,125,Blue,medium,8.5,volutpat sapien arcu sed augue aliquam erat volutpat in congue,2019-09-24,4.6,161,donec pharetra magna vestibulum aliquet ultrices erat tortor sollicitudin mi sit amet lobortis sapien sapien non mi,1.8,22,free,10.05
262,posuere metus vitae ipsum aliquam non mauris morbi non lectus aliquam sit,"Donec ut mauris eget massa tempor convallis. Nulla neque libero, convallis eget, eleifend luctus, ultricies eu, nibh. Quisque id justo sit amet sapien dignissim vestibulum. Vestibulum ante ipsum primis in faucibus orci luctus et ultrices posuere cubilia Curae; Nulla dapibus dolor vel est.",243.61,14.18,electronics,leo rhoncus sed vestibulum sit amet cursus id turpis integer aliquet,423,Violet,medium,2.2,donec semper sapien a libero nam dui proin leo odio porttitor id consequat in consequat ut nulla,2014-12-18,2.8,17,ullamcorper purus sit amet nulla quisque arcu libero rutrum ac lobortis vel dapibus at diam,4.2,108,free,40.89
263,aenean fermentum donec ut mauris eget massa tempor convallis nulla neque libero convallis,"In tempor, turpis nec euismod scelerisque, quam turpis adipiscing lorem, vitae mattis nibh ligula nec sem. Duis aliquam convallis nunc. Proin at turpis a pede posuere nonummy. Integer non velit. Donec diam neque, vestibulum eget, vulputate ut, ultrices vel, augue. Vestibulum ante ipsum primis in faucibus orci luctus et ultrices posuere cubilia Curae; Donec pharetra, magna vestibulum aliquet ultrices, erat tortor sollicitudin mi, sit amet lobortis sapien sapien non mi.",784.95,36.35,clothing,ligula nec sem duis aliquam convallis nunc proin at turpis a pede posuere nonummy integer,262,Khaki,extra large,1.9,et ultrices posuere cubilia curae nulla dapibus dolor vel est donec odio justo sollicitudin,2018-12-23,5.0,876,eleifend luctus ultricies eu nibh quisque id justo sit amet sapien dignissim vestibulum vestibulum ante ipsum primis,1.6,593,express,42.84
264,donec vitae nisi nam ultrices libero non mattis pulvinar nulla pede ullamcorper augue a suscipit nulla,"Nulla tellus. In sagittis dui vel nisl. Duis ac nibh. Fusce lacus purus, aliquet at, feugiat non, pretium quis, lectus. Suspendisse potenti. In eleifend quam a odio.",222.3,35.08,toys,mauris vulputate elementum nullam varius nulla facilisi cras non velit nec nisi vulputate,191,Orange,large,6.6,sapien non mi integer ac neque duis bibendum morbi non quam nec dui luctus rutrum nulla tellus,2017-06-13,3.1,505,sapien cursus vestibulum proin eu mi nulla ac enim in tempor turpis nec euismod scelerisque,2.3,476,express,32.62
265,vel est donec odio justo sollicitudin ut suscipit a feugiat et eros vestibulum ac est lacinia nisi venenatis tristique fusce,"Aliquam non mauris. Morbi non lectus. Aliquam sit amet diam in magna bibendum imperdiet. Nullam orci pede, venenatis non, sodales sed, tincidunt eu, felis. Fusce posuere felis sed lacus. Morbi sem mauris, laoreet ut, rhoncus aliquet, pulvinar sed, nisl. Nunc rhoncus dui vel sem. Sed sagittis.",478.97,33.42,beauty,imperdiet et commodo vulputate justo in blandit ultrices enim lorem,380,Fuscia,medium,5.3,lacus at velit vivamus vel nulla eget eros elementum pellentesque quisque porta volutpat erat,2022-12-24,4.6,195,et magnis dis parturient montes nascetur ridiculus mus vivamus vestibulum sagittis sapien cum,4.4,814,standard,37.9
266,non mattis pulvinar nulla pede ullamcorper augue a suscipit nulla elit ac nulla sed vel enim sit amet nunc viverra,Mauris lacinia sapien quis libero. Nullam sit amet turpis elementum ligula vehicula consequat. Morbi a ipsum.,380.64,12.59,clothing,mauris enim leo rhoncus sed vestibulum sit amet cursus id,893,Fuscia,large,5.7,tincidunt ante vel ipsum praesent blandit lacinia erat vestibulum sed magna at nunc commodo,2021-03-02,2.7,652,pulvinar nulla pede ullamcorper augue a suscipit nulla elit ac,3.0,930,standard,36.58
267,in sapien iaculis congue vivamus metus arcu adipiscing molestie hendrerit at vulputate vitae nisl aenean lectus pellentesque eget nunc donec,Integer ac leo. Pellentesque ultrices mattis odio.,867.39,49.01,electronics,amet lobortis sapien sapien non mi integer ac neque duis bibendum,719,Khaki,extra large,6.8,aenean lectus pellentesque eget nunc donec quis orci eget orci,2019-10-06,2.8,843,turpis elementum ligula vehicula consequat morbi a ipsum integer a nibh,3.6,556,express,46.44
268,interdum eu tincidunt in leo maecenas pulvinar lobortis est phasellus sit amet erat nulla tempus vivamus,"Etiam vel augue. Vestibulum rutrum rutrum neque. Aenean auctor gravida sem. Praesent id massa id nisl venenatis lacinia. Aenean sit amet justo. Morbi ut odio. Cras mi pede, malesuada in, imperdiet et, commodo vulputate, justo.",761.53,3.72,electronics,id ornare imperdiet sapien urna pretium nisl ut volutpat sapien,218,Turquoise,large,7.8,sapien cum sociis natoque penatibus et magnis dis parturient montes nascetur ridiculus mus etiam vel,2014-02-05,3.5,746,ac diam cras pellentesque volutpat dui maecenas tristique est et tempus semper est quam pharetra magna ac consequat metus sapien,2.9,930,standard,4.15
269,vitae mattis nibh ligula nec sem duis aliquam convallis nunc proin,"Duis aliquam convallis nunc. Proin at turpis a pede posuere nonummy. Integer non velit. Donec diam neque, vestibulum eget, vulputate ut, ultrices vel, augue. Vestibulum ante ipsum primis in faucibus orci luctus et ultrices posuere cubilia Curae; Donec pharetra, magna vestibulum aliquet ultrices, erat tortor sollicitudin mi, sit amet lobortis sapien sapien non mi. Integer ac neque. Duis bibendum. Morbi non quam nec dui luctus rutrum. Nulla tellus. In sagittis dui vel nisl.",773.71,26.96,electronics,ut erat id mauris vulputate elementum nullam varius nulla facilisi cras non velit nec nisi vulputate nonummy maecenas tincidunt,633,Khaki,extra large,7.9,in hac habitasse platea dictumst morbi vestibulum velit id pretium iaculis diam erat fermentum,2015-01-20,2.4,152,in congue etiam justo etiam pretium iaculis justo in hac habitasse platea dictumst etiam faucibus cursus urna,1.8,77,express,21.08
270,fusce congue diam id ornare imperdiet sapien urna pretium nisl ut volutpat sapien arcu sed augue aliquam erat,"Ut at dolor quis odio consequat varius. Integer ac leo. Pellentesque ultrices mattis odio. Donec vitae nisi. Nam ultrices, libero non mattis pulvinar, nulla pede ullamcorper augue, a suscipit nulla elit ac nulla. Sed vel enim sit amet nunc viverra dapibus. Nulla suscipit ligula in lacus.",67.17,48.99,beauty,diam in magna bibendum imperdiet nullam orci pede venenatis non,434,Fuscia,large,5.6,massa tempor convallis nulla neque libero convallis eget eleifend luctus ultricies eu nibh quisque id justo sit amet sapien dignissim,2019-01-07,1.6,205,orci luctus et ultrices posuere cubilia curae mauris viverra diam vitae,1.8,362,standard,20.4
271,ultrices vel augue vestibulum ante ipsum primis in faucibus orci,"Fusce posuere felis sed lacus. Morbi sem mauris, laoreet ut, rhoncus aliquet, pulvinar sed, nisl. Nunc rhoncus dui vel sem. Sed sagittis. Nam congue, risus semper porta volutpat, quam pede lobortis ligula, sit amet eleifend pede libero quis orci. Nullam molestie nibh in lectus. Pellentesque at nulla.",743.08,36.67,electronics,at nunc commodo placerat praesent blandit nam nulla integer pede justo lacinia eget tincidunt,746,Violet,small,7.8,tempor turpis nec euismod scelerisque quam turpis adipiscing lorem vitae mattis nibh ligula nec sem duis aliquam convallis nunc,2014-12-23,3.3,534,turpis elementum ligula vehicula consequat morbi a ipsum integer a nibh in quis justo maecenas rhoncus aliquam lacus morbi quis,4.6,341,free,4.87
272,in faucibus orci luctus et ultrices posuere cubilia curae duis faucibus,Suspendisse potenti. Nullam porttitor lacus at turpis. Donec posuere metus vitae ipsum. Aliquam non mauris. Morbi non lectus. Aliquam sit amet diam in magna bibendum imperdiet.,788.63,38.87,toys,aliquet maecenas leo odio condimentum id luctus nec molestie sed justo pellentesque,855,Green,small,0.5,sapien dignissim vestibulum vestibulum ante ipsum primis in faucibus orci luctus et ultrices posuere cubilia,2020-02-25,3.5,962,felis eu sapien cursus vestibulum proin eu mi nulla ac enim in,4.3,659,express,20.15
273,at nibh in hac habitasse platea dictumst aliquam augue quam sollicitudin vitae consectetuer eget,"Quisque id justo sit amet sapien dignissim vestibulum. Vestibulum ante ipsum primis in faucibus orci luctus et ultrices posuere cubilia Curae; Nulla dapibus dolor vel est. Donec odio justo, sollicitudin ut, suscipit a, feugiat et, eros. Vestibulum ac est lacinia nisi venenatis tristique. Fusce congue, diam id ornare imperdiet, sapien urna pretium nisl, ut volutpat sapien arcu sed augue.",195.62,19.56,home decor,libero convallis eget eleifend luctus ultricies eu nibh quisque id justo sit amet sapien dignissim vestibulum vestibulum ante ipsum,490,Maroon,extra large,1.5,magnis dis parturient montes nascetur ridiculus mus vivamus vestibulum sagittis sapien cum sociis natoque penatibus et magnis dis parturient montes,2011-12-10,1.6,482,dui maecenas tristique est et tempus semper est quam pharetra magna ac consequat metus sapien,4.0,632,standard,42.69
274,congue eget semper rutrum nulla nunc purus phasellus in felis donec,"Curabitur in libero ut massa volutpat convallis. Morbi odio odio, elementum eu, interdum eu, tincidunt in, leo. Maecenas pulvinar lobortis est. Phasellus sit amet erat. Nulla tempus. Vivamus in felis eu sapien cursus vestibulum. Proin eu mi. Nulla ac enim.",452.52,3.63,home decor,orci nullam molestie nibh in lectus pellentesque at nulla suspendisse potenti cras in purus eu,752,Violet,small,6.9,pede posuere nonummy integer non velit donec diam neque vestibulum eget vulputate ut ultrices vel augue vestibulum ante,2014-05-25,2.1,556,nec sem duis aliquam convallis nunc proin at turpis a pede posuere nonummy,2.7,779,express,28.99
275,elit sodales scelerisque mauris sit amet eros suspendisse accumsan tortor quis turpis sed ante vivamus tortor,Morbi non quam nec dui luctus rutrum. Nulla tellus.,77.78,13.59,clothing,iaculis justo in hac habitasse platea dictumst etiam faucibus cursus urna ut tellus nulla ut,776,Puce,small,0.7,dui maecenas tristique est et tempus semper est quam pharetra magna ac consequat metus sapien ut nunc vestibulum,2010-11-23,3.6,321,ipsum ac tellus semper interdum mauris ullamcorper purus sit amet nulla quisque arcu libero rutrum ac,3.5,759,express,17.3
276,nunc nisl duis bibendum felis sed interdum venenatis turpis enim,"Nulla ac enim. In tempor, turpis nec euismod scelerisque, quam turpis adipiscing lorem, vitae mattis nibh ligula nec sem. Duis aliquam convallis nunc. Proin at turpis a pede posuere nonummy. Integer non velit. Donec diam neque, vestibulum eget, vulputate ut, ultrices vel, augue.",859.61,22.4,clothing,ultrices posuere cubilia curae duis faucibus accumsan odio curabitur convallis duis consequat dui nec nisi volutpat eleifend,425,Indigo,large,0.3,in faucibus orci luctus et ultrices posuere cubilia curae donec pharetra magna vestibulum aliquet ultrices erat tortor sollicitudin,2016-10-03,2.8,950,lectus pellentesque eget nunc donec quis orci eget orci vehicula condimentum,4.3,588,standard,3.45
277,justo in hac habitasse platea dictumst etiam faucibus cursus urna ut tellus nulla ut erat id,"Lorem ipsum dolor sit amet, consectetuer adipiscing elit. Proin risus. Praesent lectus. Vestibulum quam sapien, varius ut, blandit non, interdum in, ante.",381.76,38.36,beauty,ullamcorper augue a suscipit nulla elit ac nulla sed vel enim,975,Puce,small,6.7,ultrices erat tortor sollicitudin mi sit amet lobortis sapien sapien non mi,2011-03-09,4.1,388,pellentesque eget nunc donec quis orci eget orci vehicula condimentum curabitur in libero ut massa volutpat convallis morbi odio,3.2,49,express,26.49
278,nulla sed accumsan felis ut at dolor quis odio consequat varius integer ac leo pellentesque ultrices mattis,"Lorem ipsum dolor sit amet, consectetuer adipiscing elit. Proin interdum mauris non ligula pellentesque ultrices. Phasellus id sapien in sapien iaculis congue. Vivamus metus arcu, adipiscing molestie, hendrerit at, vulputate vitae, nisl. Aenean lectus. Pellentesque eget nunc. Donec quis orci eget orci vehicula condimentum. Curabitur in libero ut massa volutpat convallis. Morbi odio odio, elementum eu, interdum eu, tincidunt in, leo.",204.84,46.35,home decor,cras mi pede malesuada in imperdiet et commodo vulputate justo in blandit ultrices,904,Goldenrod,small,8.1,eros elementum pellentesque quisque porta volutpat erat quisque erat eros viverra eget,2014-02-15,4.7,196,rhoncus mauris enim leo rhoncus sed vestibulum sit amet cursus id turpis,4.6,209,free,28.77
279,ultrices posuere cubilia curae duis faucibus accumsan odio curabitur convallis duis consequat dui nec nisi volutpat eleifend donec,"Cum sociis natoque penatibus et magnis dis parturient montes, nascetur ridiculus mus. Vivamus vestibulum sagittis sapien. Cum sociis natoque penatibus et magnis dis parturient montes, nascetur ridiculus mus. Etiam vel augue. Vestibulum rutrum rutrum neque. Aenean auctor gravida sem. Praesent id massa id nisl venenatis lacinia. Aenean sit amet justo. Morbi ut odio. Cras mi pede, malesuada in, imperdiet et, commodo vulputate, justo.",662.78,29.54,electronics,non sodales sed tincidunt eu felis fusce posuere felis sed lacus morbi,394,Turquoise,medium,4.7,duis at velit eu est congue elementum in hac habitasse platea,2019-12-28,1.9,24,orci nullam molestie nibh in lectus pellentesque at nulla suspendisse potenti,2.9,649,free,32.27
280,dui luctus rutrum nulla tellus in sagittis dui vel nisl duis ac nibh,"Pellentesque viverra pede ac diam. Cras pellentesque volutpat dui. Maecenas tristique, est et tempus semper, est quam pharetra magna, ac consequat metus sapien ut nunc. Vestibulum ante ipsum primis in faucibus orci luctus et ultrices posuere cubilia Curae; Mauris viverra diam vitae quam. Suspendisse potenti. Nullam porttitor lacus at turpis. Donec posuere metus vitae ipsum. Aliquam non mauris. Morbi non lectus.",776.65,35.34,clothing,ligula vehicula consequat morbi a ipsum integer a nibh in quis justo maecenas rhoncus aliquam,146,Aquamarine,extra large,7.9,vestibulum proin eu mi nulla ac enim in tempor turpis nec euismod scelerisque quam turpis adipiscing lorem vitae mattis nibh,2015-04-24,2.6,332,ultrices posuere cubilia curae nulla dapibus dolor vel est donec odio justo sollicitudin ut suscipit a feugiat et,3.9,111,free,29.63
281,convallis nulla neque libero convallis eget eleifend luctus ultricies eu nibh quisque id justo sit amet sapien,"Nulla tellus. In sagittis dui vel nisl. Duis ac nibh. Fusce lacus purus, aliquet at, feugiat non, pretium quis, lectus. Suspendisse potenti. In eleifend quam a odio.",553.75,29.12,beauty,at dolor quis odio consequat varius integer ac leo pellentesque ultrices mattis odio donec vitae nisi,841,Blue,large,0.2,eget elit sodales scelerisque mauris sit amet eros suspendisse accumsan tortor,2020-05-23,4.2,114,felis ut at dolor quis odio consequat varius integer ac leo pellentesque ultrices,1.2,302,free,7.63
282,orci vehicula condimentum curabitur in libero ut massa volutpat convallis morbi odio odio elementum,"Morbi odio odio, elementum eu, interdum eu, tincidunt in, leo. Maecenas pulvinar lobortis est. Phasellus sit amet erat. Nulla tempus.",782.82,12.34,electronics,justo sit amet sapien dignissim vestibulum vestibulum ante ipsum primis in faucibus orci luctus et ultrices posuere cubilia curae nulla,367,Fuscia,large,6.1,eget rutrum at lorem integer tincidunt ante vel ipsum praesent blandit lacinia erat vestibulum sed magna at nunc commodo placerat,2015-08-25,2.2,882,turpis sed ante vivamus tortor duis mattis egestas metus aenean,3.6,413,standard,20.75
283,enim sit amet nunc viverra dapibus nulla suscipit ligula in lacus curabitur at ipsum ac tellus,"Mauris enim leo, rhoncus sed, vestibulum sit amet, cursus id, turpis. Integer aliquet, massa id lobortis convallis, tortor risus dapibus augue, vel accumsan tellus nisi eu orci. Mauris lacinia sapien quis libero. Nullam sit amet turpis elementum ligula vehicula consequat. Morbi a ipsum.",314.12,43.62,clothing,curae mauris viverra diam vitae quam suspendisse potenti nullam porttitor lacus at turpis donec posuere metus vitae ipsum aliquam non,794,Aquamarine,medium,4.5,sed vestibulum sit amet cursus id turpis integer aliquet massa,2012-02-15,2.3,944,ut suscipit a feugiat et eros vestibulum ac est lacinia nisi venenatis tristique fusce congue diam id ornare imperdiet sapien,3.2,455,standard,18.45
284,vestibulum sit amet cursus id turpis integer aliquet massa id lobortis,"Maecenas tincidunt lacus at velit. Vivamus vel nulla eget eros elementum pellentesque. Quisque porta volutpat erat. Quisque erat eros, viverra eget, congue eget, semper rutrum, nulla. Nunc purus. Phasellus in felis. Donec semper sapien a libero. Nam dui. Proin leo odio, porttitor id, consequat in, consequat ut, nulla. Sed accumsan felis.",526.52,7.2,home decor,amet lobortis sapien sapien non mi integer ac neque duis bibendum morbi non,461,Maroon,extra large,8.7,metus arcu adipiscing molestie hendrerit at vulputate vitae nisl aenean lectus pellentesque,2010-10-31,4.9,614,ligula sit amet eleifend pede libero quis orci nullam molestie nibh in,2.3,155,express,32.92
285,vitae mattis nibh ligula nec sem duis aliquam convallis nunc proin at turpis a pede posuere,Nullam varius. Nulla facilisi. Cras non velit nec nisi vulputate nonummy.,166.06,48.05,home decor,duis aliquam convallis nunc proin at turpis a pede posuere nonummy integer non velit,688,Maroon,extra large,5.6,ipsum ac tellus semper interdum mauris ullamcorper purus sit amet,2022-11-29,2.1,909,libero non mattis pulvinar nulla pede ullamcorper augue a suscipit nulla,3.0,880,standard,49.06
286,turpis nec euismod scelerisque quam turpis adipiscing lorem vitae mattis,Integer ac neque. Duis bibendum. Morbi non quam nec dui luctus rutrum.,851.5,49.55,home decor,proin leo odio porttitor id consequat in consequat ut nulla sed,778,Puce,small,8.5,posuere metus vitae ipsum aliquam non mauris morbi non lectus aliquam,2020-07-20,2.7,198,ultrices posuere cubilia curae mauris viverra diam vitae quam suspendisse potenti nullam porttitor lacus,4.2,106,standard,7.29
287,in blandit ultrices enim lorem ipsum dolor sit amet consectetuer adipiscing elit proin interdum mauris non ligula pellentesque ultrices,"Nam dui. Proin leo odio, porttitor id, consequat in, consequat ut, nulla.",269.4,4.68,home decor,duis at velit eu est congue elementum in hac habitasse platea dictumst morbi vestibulum velit id pretium,90,Red,small,8.8,sociis natoque penatibus et magnis dis parturient montes nascetur ridiculus mus vivamus vestibulum sagittis,2019-05-09,1.5,84,volutpat convallis morbi odio odio elementum eu interdum eu tincidunt in leo maecenas pulvinar lobortis est phasellus sit,4.2,679,free,10.85
288,leo rhoncus sed vestibulum sit amet cursus id turpis integer aliquet massa id lobortis convallis tortor,"Suspendisse ornare consequat lectus. In est risus, auctor sed, tristique in, tempus sit amet, sem. Fusce consequat. Nulla nisl. Nunc nisl. Duis bibendum, felis sed interdum venenatis, turpis enim blandit mi, in porttitor pede justo eu massa. Donec dapibus. Duis at velit eu est congue elementum. In hac habitasse platea dictumst.",649.01,3.62,clothing,quis odio consequat varius integer ac leo pellentesque ultrices mattis odio donec vitae nisi,947,Yellow,medium,3.9,sed nisl nunc rhoncus dui vel sem sed sagittis nam congue risus semper porta volutpat quam pede lobortis ligula sit,2015-01-29,3.1,578,at velit eu est congue elementum in hac habitasse platea dictumst morbi,3.0,686,express,14.44
289,duis ac nibh fusce lacus purus aliquet at feugiat non pretium quis lectus suspendisse,"Suspendisse ornare consequat lectus. In est risus, auctor sed, tristique in, tempus sit amet, sem. Fusce consequat. Nulla nisl. Nunc nisl.",55.74,39.74,beauty,montes nascetur ridiculus mus etiam vel augue vestibulum rutrum rutrum neque aenean auctor,101,Turquoise,medium,6.5,morbi ut odio cras mi pede malesuada in imperdiet et commodo vulputate justo in blandit ultrices enim lorem,2014-04-27,2.4,685,odio porttitor id consequat in consequat ut nulla sed accumsan felis ut at dolor,4.1,808,standard,18.67
290,venenatis non sodales sed tincidunt eu felis fusce posuere felis sed lacus morbi sem mauris laoreet ut,"Fusce consequat. Nulla nisl. Nunc nisl. Duis bibendum, felis sed interdum venenatis, turpis enim blandit mi, in porttitor pede justo eu massa. Donec dapibus. Duis at velit eu est congue elementum. In hac habitasse platea dictumst.",81.93,6.44,toys,laoreet ut rhoncus aliquet pulvinar sed nisl nunc rhoncus dui vel sem sed sagittis nam,162,Turquoise,medium,0.6,eget eleifend luctus ultricies eu nibh quisque id justo sit amet sapien dignissim vestibulum vestibulum ante ipsum primis in,2015-12-03,2.6,620,elit sodales scelerisque mauris sit amet eros suspendisse accumsan tortor quis turpis sed,3.3,686,express,48.43
291,odio consequat varius integer ac leo pellentesque ultrices mattis odio,"Nam dui. Proin leo odio, porttitor id, consequat in, consequat ut, nulla. Sed accumsan felis. Ut at dolor quis odio consequat varius. Integer ac leo. Pellentesque ultrices mattis odio. Donec vitae nisi. Nam ultrices, libero non mattis pulvinar, nulla pede ullamcorper augue, a suscipit nulla elit ac nulla. Sed vel enim sit amet nunc viverra dapibus. Nulla suscipit ligula in lacus.",278.09,5.2,toys,tristique in tempus sit amet sem fusce consequat nulla nisl nunc nisl duis bibendum felis sed interdum venenatis turpis enim,726,Violet,extra large,0.6,consequat ut nulla sed accumsan felis ut at dolor quis odio consequat varius,2019-06-18,2.2,900,habitasse platea dictumst morbi vestibulum velit id pretium iaculis diam erat fermentum justo nec condimentum neque sapien,3.6,468,express,0.72
